[
  {
    "name": "1password-cli",
    "summary": "Provision secrets across development environments.",
    "uri": "https://developer.1password.com/docs/cli/",
    "installs": {
      "common": "#script",
      "freebsd": {"common": "1password-client2"},
      "linux": {"gentoo": "app-admin/op-cli-bin"}
    },
    "provides": {"common": ["op"]}
  }
]
