[
  {
    "name": "7zip",
    "summary": "A file archiver with a high compression ratio.",
    "uri": "https://www.7-zip.org/",
    "installs": {
      "freebsd": {"common": "7-zip"},
      "linux": {
        "debian": {
          "common": "7zip",
          "bullseye": "p7zip",
          "buster": "p7zip"
        },
        "gentoo": "app-arch/p7zip",
        "ubuntu": {
          "common": "7zip",
          "focal": "p7zip"
        }
      },
      "windows": "#builtin"
    },
    "provides": {
      "freebsd": {"common": ["7z"]},
      "linux": {
        "alpine": {"common": ["7z"]},
        "debian": {
          "sid": ["7z", "7za", "7zr"],
          "trixie": ["7z", "7za", "7zr"],
          "bookworm": ["7zz"],
          "bullseye": ["7zr"],
          "buster": ["7zr"]
        },
        "gentoo": ["7z", "7za", "7zr"],
        "ubuntu": {
          "noble": ["7z", "7za", "7zr"],
          "mantic": ["7zz"],
          "lunar": ["7zz"],
          "jammy": ["7zz"],
          "focal": ["7zr"]
        }
      },
      "windows": ["7z"]
    }
  },
  {
    "name": "chezmoi",
    "summary": "Manage your dotfiles across multiple diverse machines, securely.",
    "uri": "https://chezmoi.io/",
    "installs": {"common": "#builtin"}
  },
  {
    "name": "cmake",
    "summary": "An open-source, cross-platform family of tools designed to build, test and package software.",
    "uri": "https://cmake.org/",
    "installs": {
      "common": "#na",
      "linux": {"gentoo": "#custom"}
    },
    "provides": {"linux": {"gentoo": ["cmake"]}}
  },
  {
    "name": "curl",
    "summary": "A command line tool and library for transferring data with URL syntax.",
    "uri": "https://curl.se/",
    "installs": {
      "freebsd": {"common": "#builtin"},
      "linux": {"gentoo": "#builtin"},
      "windows": "#builtin"
    }
  },
  {
    "name": "delta",
    "summary": "A viewer for git and diff output.",
    "uri": "https://dandavison.github.io/delta/",
    "installs": {
      "freebsd": {"common": "git-delta"},
      "linux": {
        "debian": {
          "common": "#custom",
          "bullseye": "#na",
          "buster": "#na"
        },
        "gentoo": "dev-util/git-delta",
        "ubuntu": {
          "common": "#custom",
          "focal": "#na"
        }
      }
    },
    "provides": {
      "freebsd": {"common": ["delta"]},
      "linux": {
        "alpine": {"common": ["delta"]},
        "debian": {
          "sid": ["delta"],
          "trixie": ["delta"],
          "bookworm": ["delta"]
        },
        "gentoo": ["delta"],
        "ubuntu": {
          "noble": ["delta"],
          "mantic": ["delta"],
          "lunar": ["delta"],
          "jammy": ["delta"]
        }
      },
      "windows": ["delta"]
    }
  },
  {
    "name": "fish-shell",
    "summary": "The user-friendly command line shell.",
    "uri": "https://github.com/fish-shell/fish-shell",
    "installs": {
      "common": "fish",
      "linux": {"gentoo": "#custom"},
      "windows": "#na"
    },
    "provides": {
      "freebsd": {"common": ["fish"]},
      "linux": {"common": ["fish"]}
    }
  },
  {
    "name": "git",
    "summary": "Distributed version control system.",
    "uri": "https://git-scm.com/",
    "installs": {
      "linux": {"gentoo": "dev-vcs/git"},
      "windows": "#builtin"
    },
    "provides": {
      "common": ["git"],
      "windows": ["sh", "bash", "gitk", "git-gui", "scalar", "tig", "git-bash"]
    }
  },
  {
    "name": "jq",
    "summary": "A command-line JSON processor that uses a domain-specific language.",
    "uri": "https://stedolan.github.io/jq/",
    "installs": {
      "freebsd": {"common": "#custom"},
      "linux": {"common": "#custom"}
    }
  },
  {
    "name": "nano",
    "summary": "Command-line text editor.",
    "uri": "https://nano-editor.org/"
  },
  {
    "name": "neofetch",
    "summary": "Display information about your operating system, software and hardware.",
    "uri": "https://github.com/dylanaraps/neofetch"
  },
  {
    "name": "openssh",
    "summary": "Connectivity tool for remote login with the SSH protocol",
    "uri": "https://www.openssh.com/",
    "installs": {
      "freebsd": {"common": "#builtin"},
      "linux": {
        "debian": {"common": "openssh-server"},
        "gentoo": "#builtin",
        "ubuntu": {"common": "openssh-server"}
      },
      "windows": "#builtin"
    },
    "provides": {"common": ["ssh", "ssh-keygen"]}
  },
  {
    "name": "silver searcher, the",
    "summary": "A code-searching tool similar to ack, but faster.",
    "uri": "https://geoff.greer.fm/ag/",
    "provides": {"common": ["ag"]}
  },
  {
    "name": "starship",
    "summary": "The minimal, blazing-fast, and infinitely customizable prompt for any shell!",
    "uri": "https://starship.rs/",
    "installs": {
      "linux": {
        "debian": {"common": "#custom"},
        "ubuntu": {"common": "#custom"}
      },
      "windows": "#custom"
    }
  },
  {
    "name": "sudo",
    "summary": "Executes a single command as the superuser or another user.",
    "uri": "https://www.sudo.ws/"
  },
  {
    "name": "task",
    "summary": "A task runner / simpler Make alternative.",
    "uri": "https://taskfile.dev/",
    "installs": {
      "common": "#custom",
      "freebsd": {"common": "#custom"},
      "linux": {"alpine": {"common": "go-task"}},
      "windows": "task"
    },
    "provides": {
      "freebsd": {"common": ["task"]},
      "linux": {
        "alpine": {"common": ["go-task"]},
        "debian": {"common": ["task"]},
        "gentoo": ["task"],
        "ubuntu": {"common": ["task"]}
      },
      "windows": ["task"]
    }
  },
  {
    "name": "tealdeer",
    "summary": "Display simple help pages for command-line tools from the tldr-pages project.",
    "uri": "https://tldr.sh/",
    "provides": {"common": ["tldr"]}
  }
]
